{
  "schema_version": 4,
  "id": "demo-calibration-template",
  "display_name": "自定义角色表情模板",
  "renderer": "live2d_mocari",
  "entry": "model/model.model3.json",
  "interaction": {
    "head": [
      [
        0.3,
        0.1
      ],
      [
        0.7,
        0.1
      ],
      [
        0.7,
        0.45
      ],
      [
        0.3,
        0.45
      ]
    ],
    "body": [
      [
        0.35,
        0.45
      ],
      [
        0.65,
        0.45
      ],
      [
        0.65,
        0.9
      ],
      [
        0.35,
        0.9
      ]
    ],
    "anchor": [
      0.5,
      0.96
    ],
    "window_perch_y": 0.5,
    "regions": {
      "face": [
        [
          0.42,
          0.23
        ],
        [
          0.58,
          0.23
        ],
        [
          0.58,
          0.34
        ],
        [
          0.42,
          0.34
        ]
      ],
      "left_hand": [
        [
          0.27,
          0.52
        ],
        [
          0.34,
          0.52
        ],
        [
          0.34,
          0.59
        ],
        [
          0.27,
          0.59
        ]
      ],
      "right_hand": [
        [
          0.66,
          0.52
        ],
        [
          0.73,
          0.52
        ],
        [
          0.73,
          0.59
        ],
        [
          0.66,
          0.59
        ]
      ],
      "upper_body": [
        [
          0.4,
          0.36
        ],
        [
          0.6,
          0.36
        ],
        [
          0.6,
          0.5
        ],
        [
          0.4,
          0.5
        ]
      ],
      "lower_body": [
        [
          0.39,
          0.52
        ],
        [
          0.61,
          0.52
        ],
        [
          0.61,
          0.63
        ],
        [
          0.39,
          0.63
        ]
      ],
      "left_arm": [
        [
          0.32,
          0.4
        ],
        [
          0.4,
          0.4
        ],
        [
          0.34,
          0.54
        ],
        [
          0.28,
          0.54
        ]
      ],
      "right_arm": [
        [
          0.6,
          0.4
        ],
        [
          0.68,
          0.4
        ],
        [
          0.72,
          0.54
        ],
        [
          0.66,
          0.54
        ]
      ],
      "abdomen": [
        [
          0.43,
          0.43
        ],
        [
          0.57,
          0.43
        ],
        [
          0.57,
          0.57
        ],
        [
          0.43,
          0.57
        ]
      ],
      "left_leg": [
        [
          0.42,
          0.62
        ],
        [
          0.5,
          0.62
        ],
        [
          0.5,
          0.9
        ],
        [
          0.42,
          0.9
        ]
      ],
      "right_leg": [
        [
          0.51,
          0.62
        ],
        [
          0.59,
          0.62
        ],
        [
          0.59,
          0.9
        ],
        [
          0.51,
          0.9
        ]
      ],
      "left_foot": [
        [
          0.42,
          0.9
        ],
        [
          0.5,
          0.9
        ],
        [
          0.5,
          0.97
        ],
        [
          0.42,
          0.97
        ]
      ],
      "right_foot": [
        [
          0.51,
          0.9
        ],
        [
          0.59,
          0.9
        ],
        [
          0.59,
          0.97
        ],
        [
          0.51,
          0.97
        ]
      ]
    },
    "region_parts": {
      "lower_body": [
        [
          [
            0.35,
            0.56
          ],
          [
            0.39,
            0.56
          ],
          [
            0.39,
            0.66
          ],
          [
            0.35,
            0.66
          ]
        ],
        [
          [
            0.61,
            0.56
          ],
          [
            0.65,
            0.56
          ],
          [
            0.65,
            0.66
          ],
          [
            0.61,
            0.66
          ]
        ]
      ]
    }
  },
  "actions": {
    "head_pat": null,
    "body_tap": null,
    "feed": null,
    "play": null,
    "rest": null,
    "greet": null,
    "peek": null,
    "invite": null
  },
  "parameter_map": {},
  "license": {
    "status": "unverified",
    "redistributable": false
  },
  "expression_profile": {
    "catalog": {
      "neutral": {
        "path": "model/neutral.exp3.json",
        "label": "中性"
      },
      "happy": {
        "path": "model/happy.exp3.json",
        "label": "开心"
      }
    },
    "baseline": {
      "neutral": "neutral",
      "cheerful": "happy"
    },
    "reactions": {
      "head_pat": [
        {
          "expression": "happy",
          "duration_ms": 1200
        }
      ]
    }
  }
}
